Treatment,Treatment_Type,Outcome,Method,N,Effect_Beta,SE,CI_Lower,CI_Upper,p_value,Interpretation,Estimator,Cross_Fit_Splits,Discrete_Treatment,Analysis_Type,N_Treated,N_Control,Raw_Difference,Pseudo_R2,Y_treated_mean,Y_control_mean,Effect_Beta_OLS,p_value_OLS,Effect_Beta_GPS,p_value_GPS,SE_OLS,CI_Lower_OLS,CI_Upper_OLS,CI_Lower_GPS,CI_Upper_GPS,R2,GAM_EDF,Tertile_Diff,Tertile_p,Exposure_mean,Exposure_median,Outcome_Mean,Outcome_Median,Outcome_Control_Mean,Absolute_Change_ATE,Relative_Change_Pct_vs_ControlMean,Relative_Change_CI_Lower_Pct,Relative_Change_CI_Upper_Pct
mo14_ai_automate_routine_tasks_pct,Continuous,dv21_premature_death_ypll_rate,Double Machine Learning (DML),2898,-5.179454377144756,5.009168382084455,-14.997424406030287,4.638515651740775,0.301138564552772,Change in YPLL per 1-unit increase in exposure,LinearDML with RandomForest (Continuous GPS),5.0,False,PRIMARY,,,,,,,,,,,,,,,,,,,,,,,,,,,,
mo14_ai_automate_routine_tasks_pct,Continuous,dv21_premature_death_ypll_rate,GPS-IPW (Generalized Propensity Score),2898,-2.5622742761767867,1.3338994388543457,-5.176717176331304,0.05216862397773081,0.05475001041806299,Change in YPLL per 1-unit increase in exposure,Stabilized GPS Weights (Hirano & Imbens 2004),,False,SECONDARY,,,,,,,,,,,,,,,,,,,,,,,,,,,,
mo14_ai_automate_routine_tasks_pct,Two-Part Extensive,dv21_premature_death_ypll_rate,Two-Part Model (Hurdle) - Extensive Margin,2898,-510.30040929135686,,,,,Participation Effect: Any AI vs None (AIPW-Adjusted),Logit + AIPW,,True,ECONOMETRIC,414.0,2484.0,-1963.9999692367091,0.30975839409733175,8245.486500320803,10209.486469557512,,,,,,,,,,,,,,,,,,,,,,
mo14_ai_automate_routine_tasks_pct,Two-Part Intensive,dv21_premature_death_ypll_rate,Two-Part Model (Hurdle) - Intensive Margin,414,,,,,,"Intensity Effect: More AI vs Less AI (among adopters, using GPS-IPW for causal inference)",OLS + GPS-IPW (Causal) + Nonlinearity Checks,,False,ECONOMETRIC,,,,,,,1.0159029408678224,0.46612239370829744,-1.7489080702598958,0.3222983118415228,1.393934213259646,-1.7161579139392589,3.7479637956749037,-5.212217869564306,1.7144017290445137,0.8882134391867377,2.3664199574451326,442.5038991734591,0.10350791204521237,65.4556669753484,72.6482590655727,,,,,,,
mo14_ai_automate_routine_tasks_pct,Binary (>Median),dv21_premature_death_ypll_rate,Double Machine Learning (DML),2898,-436.96465252143446,341.8598776917238,-1107.0100127972132,233.08070775434413,0.20117957932307107,ATE: High vs Low (median split),LinearDML with RandomForest (Binary),5.0,True,SENSITIVITY,414.0,2484.0,,,,,,,,,,,,,,,,,,,,9928.91504538084,9462.1640625,10209.486469557512,-436.96465252143446,-4.279986597018066,-10.84295489394181,2.2829816999056765
